73,dilettante,"a person who cultivates an area of interest, such as the arts, without real commitment or knowledge.",a wealthy literary dilettante,"trifler, dabbler, layperson, layman, non-specialist, tinkerer, dallier, amateur, non-professional, potterer"
74,discomfit,make (someone) feel uneasy or embarrassed.,he was not noticeably discomfited by her tone,"disorientate, discombobulate, discompose, take aback, embarrass, faze, make uncomfortable, put someone off their stroke, chagrin, mortify, disturb, distress, perturb, fluster, disconcert, rattle, upset, make uneasy, nonplus, abash, unsettle, discomfort, agitate, confuse, ruffle, unnerve"
75,disconsolate,very unhappy and unable to be comforted.,she left Fritz looking disconsolate,"down in the dumps, in the doldrums, downhearted, heartbroken, heavy-hearted, choked, forlorn, heartsore, fed up, woebegone, disappointed, crushed, wretched, chap-fallen, desolate, long-faced, heartsick, dejected, melancholy, unhappy, downcast, low-spirited, dismal, down in the mouth, cheesed off, dispirited, dolorous, crestfallen, doleful, glum, discouraged, down, cast down, demoralized, inconsolable, despondent, disheartened, depressed, broken-hearted, blue, brassed off, sad, miserable, as sick as a parrot, gloomy"
76,disparage,regard or represent as being of little worth.,he never missed an opportunity to disparage his competitors,"sneer at, denigratory, ridicule, scorn, defame, deprecating, slander, pan, dismiss, pick holes in, catty, unsympathetic, contumelious, rubbish, speak ill of, slate, scornful, slur, condemn, libel, cast aspersions on, bad-mouth, misprize, critical, hit out at, run down, pull apart, downgrade, treat lightly, traduce, disdain, revile, laugh at, underestimate, impugn, scathing, asperse, do down, belittling, belittle, speak badly of, criticize, uncomplimentary, minimize, denigrate, depreciate, vilify, derogate, contemptuous, uncharitable, cry down, deflate, play down, vituperate, deprecatory, vilipend, drag through the mud, snide, derogatory, mock, pull to pieces, undervalue, trivialize, bitchy, pooh-pooh, minify, do a hatchet job on, look down one's nose at, unfavourable, derisive, malign, hold cheap, laugh off, pour scorn on, bash, slag off, decry, take to pieces, abusive, negative, slighting, deride, underrate, have a go at, make light of, discredit, disdainful, calumniate, sneering, deprecate, scoff at, knock, slam, insulting"
77,disseminated,having spread throughout an organ or the body.,symptoms vary from mild localized disease to severe disseminated infection,
78,dissension,disagreement that leads to discord.,these issues caused bitter dissension in the party,"dispute, debate, variance, contention, discordance, bickering, disagreement, difference of opinion, quarrelling, dissent, squabbling, falling-out, discordancy, disaffection, wrangling, controversy, antagonism, argument, discord, conflict, disputation, disunion, rivalry, strife, friction"
80,docile,ready to accept control or instruction; submissive.,a cheap and docile workforce,"unresisting, controllable, biddable, manageable, obedient, amenable, milky, tractable, deferential, persuadable, compliant, mild, dutiful, accommodating, manipulable, like putty in one's hands, unassertive, pliant, easily handled, tame, ductile, malleable, passive, submissive, easily manipulated, lamblike, willing, cooperative, persuasible, meek, yielding"
81,dogmatic,inclined to lay down principles as undeniably true.,she was not tempted to be dogmatic about what she believed,"imperative, emphatic, opinionated, unquestionable, uncompromising, adamant, insistent, assertive, unbending, dictatorial, small-minded, inflexible, arrogant, authoritative, unyielding, domineering, pontifical, peremptory, intolerant, overbearing, unchallengeable, rigid, imperious, high-handed, narrow-minded, authoritarian, doctrinaire, entrenched"
82,dubious,"hesitating or doubting., not to be relied upon; suspect.","I was rather dubious about the whole idea, extremely dubious assumptions","doubtful, undependable, suspicious, unreliable, imprecise, open to question, unclear, in a quandary, suspect, ambiguous, indeterminate, wavering, unsure, untrustworthy, puzzling, unconfirmed, sceptical, unsettled, up in the air, not kosher, vague, hesitant, in a dilemma, undetermined, enigmatic, cryptic, shady, in doubt, on the horns of a dilemma, funny, dodgy, fishy, uncertain, undecided, equivocal, debatable, unresolved, questionable, hazy, indefinite, iffy, under suspicion, vacillating, irresolute"
83,dulcet,(especially of sound) sweet and soothing (often used ironically).,record the dulcet tones of your family and friends,"melodious, lyrical, tuneful, silver-toned, easy on the ear, lilting, bell-like, mellow, mellifluous, harmonious, sweet, silvery, honeyed, mellifluent, soothing, euphonious, sweet-sounding, agreeable, melodic, pleasant, golden, musical"
84,ebullience,the quality of being cheerful and full of energy; exuberance.,the ebullience of happy children,"light-heartedness, pep, good cheer, jauntiness, breeziness, jubilation, bounciness, sunniness, chirpiness, cheerfulness, euphoria, exuberance, buoyancy, animation, zip, joy, cheeriness, joyfulness, fizz, elation, zest, merriment, exhilaration, enthusiasm, zing, bubbliness, high spirits, high-spiritedness, jollity, irrepressibility, vivacity, perkiness, gladness, effervescence, sparkle"
85,elucidation,explanation that makes something clear; clarification.,work that led to the elucidation of the structure of proteins,"illumination, comment, gloss, account, exposition, explication, commentary, explanation, interpretation, clarification, exegesis, report, setting out, annotation"
86,emaciated,"abnormally thin or weak, especially because of illness or a lack of food.",she was so emaciated she could hardly stand,"half-starved, pinched, gaunt, haggard, scraggy, underweight, bony, cadaverous, atrophied, shrivelled, withered, anorexic, attenuated, undernourished, skeletal, thin as a rake, size-zero, phthisical, skin and bones, skinny, raw-boned, sticklike, wasted, thin, angular, underfed, looking like a bag of bones, wizened, shrunken, drawn, starved, scrawny"
87,entrenched,"(of an attitude, habit, or belief) firmly established and difficult or unlikely to change; ingrained.",an entrenched resistance to change,"unshakeable, immutable, deep-seated, well established, rooted, inexorable, ineradicable, indelible, long-established, deep-set, fixed, firm, irremovable, established, inveterate, ingrained, set firm, dyed-in-the-wool, deep-rooted, confirmed"
88,equanimity,"calmness and composure, especially in a difficult situation.",she accepted both the good and the bad with equanimity,"aplomb, self-confidence, equilibrium, calmness, presence of mind, composure, impassivity, unflappability, assurance, coolness, calm, poise, ataraxy, sangfroid, nerve, cool-headedness, self-control, unexcitability, serenity, cool, tranquillity, even-temperedness, self-assurance, placidity, phlegm, self-possession, imperturbability, level-headedness"
89,equivocal,open to more than one interpretation; ambiguous.,the equivocal nature of her remarks,
90,ersatz,"(of a product) made or used as a substitute, typically an inferior one, for something else.",ersatz coffee,"low-quality, inferior, farkakte, synthetic, false, sham, man-made, fake, substandard, counterfeit, fabricated, facsimile, pretended, mock, so-called, reproduction, plastic, forged, low-grade, imitation, pseudo, replica, artificial, shoddy, spurious, adulterated, substitute, simulated, phoney, manufactured, faux, poor-quality, unsatisfactory, unnatural, bogus"
91,eschew,deliberately avoid using; abstain from.,he appealed to the crowd to eschew violence,"abjure, disavow, reject, drop, renege on, gainsay, pack in, forgo, abandon, relinquish, abnegate, wash one's hands of, deny, have nothing to do with, disaffirm, renounce, abdicate, disclaim, forsake, shun, swear off, steer clear of, refrain from, jack in, spurn, give a wide berth to, kick, forswear, fight shy of, give up, dispense with, abstain from, repudiate"
92,espouse,"adopt or support (a cause, belief, or way of life)., marry.","she espoused the causes of justice and freedom for all, Edward had espoused the lady Grey","prefer, support, take someone's part, give help to, fall in with, back, stand up for, help, be on the side of, endorse, stand behind, take to one's heart, vouch for, sanction, give one's blessing to, take up, abet, further, adopt, champion, favour, throw one's weight behind, accept, sponsor, stick up for, ally oneself with, encourage, welcome, advocate, assist, take up the cudgels for, take to, approve of, defend, smile on, aid and abet, side with, vote for, aid, promote, embrace, be in favour of"
93,evince,reveal the presence of (a quality or feeling); indicate.,the news stories evinced the usual mixture of sympathy and satisfaction,"attest to, testify to, bespeak, make plain, betray, exhibit, manifest, demonstrate, make manifest, make clear, disclose, bear witness to, be evidence of, impart, lay bare, expose, display, give away, indicate, reveal, divulge, show, evidence, convey, proclaim, communicate, make obvious"
94,excoriate,"damage or remove part of the surface of (the skin)., criticize (someone) severely.","the discharge is acrid and excoriates the skin of the nose, he excoriated the government for censorship","reprobate, rub away, pick holes in, censure, carp at, derogate, disparage, give a bad press to, asperse, bag, denigrate, rub off, nitpick about, lambast, slur, pan, skin, blast, run down, rub raw, cavil at, condemn, slag off, scratch, rail against, deprecate, lace into, maul, inveigh against, chafe, criticize, hit out at, bag on, scrape, strip away, animadvert on, slam, lay into, disapprove of, throw brickbats at, abrade, hammer, pour scorn on, cast aspersions on, slash, vilify, knock, give flak to, find fault with, pummel, attack, crucify, damage, savage, vituperate against, pillory, roast, besmirch, decorticate, monster, malign, cut up, objurgate, skewer, give some stick to, reprehend, peel away, slate, denounce, rubbish, have a go at, rate, trash, pull to pieces, bad-mouth, arraign, pull apart, sledge"
95,exemplify,"be a typical example of., illustrate or clarify by giving an example.","the best dry sherry is exemplified by the fino of Jerez, he exemplified his point with an anecdote","instance, show, epitomize, symbolize, embody, demonstrate, give an instance of, serve as a typical example of, instantiate, illustrate, be representative of, typify, be a typical example of, give an example of, represent, be the embodiment of, personify"
96,exiguous,very small in size or amount.,my exiguous musical resources,"paltry, small, limited, deficient, stingy, inadequate, modest, piddling, puny, meagre, measly, sparse, miserly, beggarly, pathetic, insufficient, short, scanty, scant, niggardly, little, restricted, skimpy, spare, negligible, miserable, pitiful"
97,expansive,"covering a wide area in terms of space or scope; extensive., (of a person or their manner) relaxed and genially frank and communicative., tending towards economic or political expansion.","expansive beaches, he was in an expansive mood, expansive domestic economic policies","outgoing, comprehensive, extroverted, interdisciplinary, affable, demonstrative, talky, extrovert, chatty, genial, garrulous, multidisciplinary, open, unreserved, discursive, rolling, sweeping, extensive, uninhibited, conversational, broad, inclusive, communicative, forthcoming, friendly, spacious, amiable, voluble, effusive, all-embracing, loquacious, thorough, wide, sociable, talkative, wide-ranging, cross-disciplinary"
98,expository,intended to explain or describe something.,an expository prologue,"explicative, exegetic, hermeneutic, interpretative, elucidatory, describing, explicatory, illustrative, elucidative, illuminating, descriptive, explanatory"
99,extol,praise enthusiastically.,he extolled the virtues of the Russian peoples,"praise to the skies, go on about, eulogize, gush about/over, enthuse about/over, praise enthusiastically, rhapsodize over, laud, express delight over, throw bouquets at, go wild about, rave about, heap praise on, sing the praises of, wax lyrical about, acclaim, go into raptures about/over, panegyrize, ballyhoo, cry someone/something up, be mad about, big someone/something up"
100,facile,"ignoring the true complexities of an issue; superficial., (especially of success in sport) easily achieved; effortless.","facile generalizations, a facile seven-lengths victory","simplistic, straightforward, pat, shallow, child's play, no sweat, duck soup, slick, naive, undemanding, a doddle, a pushover, a breeze, oversimple, as easy as ABC, uncomplicated, dime-store, bubblegum, unchallenged, leisurely, a cinch, a snap, effortless, glib, easy, money for jam, jejune, painless, easy-peasy, a bludge, schematic, superficial, trouble-free, kids' stuff, oversimplified, money for old rope, unexacting, as easy as pie, as easy as falling off a log, simple, a piece of cake, black and white, elementary"
102,factious,relating or inclined to dissension.,a factious country,"insurrectionary, rebellious, at loggerheads, dissident, disharmonious, quarrelling, at variance, at odds, tumultuous, warring, argumentative, quarrelsome, conflicting, divided, disputatious, mutinous, disagreeing, discordant, dissenting, sectarian, clashing, schismatic, turbulent, seditious, split, contentious"
103,fastidious,very attentive to and concerned about accuracy and detail.,she dressed with fastidious care,"critical, fussy, pernickety, hypercritical, punctilious, assiduous, finicky, exacting, choosy, pass-remarkable, scrupulous, nice, sedulous, meticulous, precise, overcritical, demanding, hair-splitting, persnickety, picky, nitpicking, perfectionist, over-particular, dainty, pedantic, exact, painstaking, overnice"
105,fatuous,silly and pointless.,a fatuous comment,"vacuous, gormless, asinine, ludicrous, inane, preposterous, dumb, foolish, childish, moronic, mindless, nonsensical, ridiculous, silly, idiotic, senseless, daft, brainless, hare-brained, puerile, stupid, empty-headed, cretinous, witless, imbecilic, absurd, laughable, pointless, risible, infantile"
106,fawning,displaying exaggerated flattery or affection; obsequious.,fawning adoration,
108,fealty,a feudal tenant's or vassal's sworn loyalty to a lord.,they owed fealty to the Earl rather than the King,
109,feckless,lacking initiative or strength of character; irresponsible.,her feckless younger brother,"aimless, apathetic, idle, indolent, slothful, inefficient, ne'er-do-well, good-for-nothing, no-good, inept, useless, lousy, lazy, shiftless, unenterprising, worthless, unambitious, no-account, spiritless, incompetent"
110,felicitous,well chosen or suited to the circumstances.,a felicitous phrase,"fitting, to the point, apposite, pertinent, apt, spot on, well expressed, suitable, appropriate, germane, congruous, choice, apropos, well put, relevant, well chosen"
111,fetid,smelling extremely unpleasant.,the fetid water of the marsh,"malodorous, pungent, nasty, high, funky, fresh, foul-smelling, noisome, stinky, smelly, reeking, stinking to high heaven, pongy, unpleasant, olid, niffing, noxious, acrid, whiffy, mephitic, humming, miasmal, niffy, foul, miasmic, reeky, stinking, rank, evil-smelling"
112,flagged,paved with flat stone slabs.,"a large, flagged vestibule",
113,flagrant,(of an action considered wrong or immoral) conspicuously or obviously offensive.,a flagrant violation of the law,"brazen, undisguised, complete, disgraceful, wicked, outrageous, transparent, naked, audacious, obvious, manifest, blatant, conspicuous, utter, atrocious, shocking, shameless, terrible, dreadful, glaring, patent, overt, evident, arrant, enormous, villainous, scandalous, reprehensible, brass-necked, unconcealed, gross, iniquitous, heinous, palpable, out and out, monstrous, barefaced"
114,flippant,not showing a serious or respectful attitude.,a flippant remark,"saucy, offhand, facetious, pert, thoughtless, shallow, glib, frivolous, irresponsible, disrespectful, flip, sassy, cheeky, carefree, irreverent, overfamiliar, superficial, impertinent, impudent, insouciant"
115,flout,"openly disregard (a rule, law, or convention)., mock; scoff.","the advertising code is being flouted, the women pointed and flouted at her","go against, cock a snook at, infringe, set at naught, fly in the face of, disobey, disdain, thumb one's nose at, kick against, set one's face against, violate, commit a breach of, defy, disregard, fail to observe, poke fun at, break, contravene, refuse to obey, infract, make a fool of, show contempt for, fail to comply with, transgress against, rebel against, ignore, scorn, breach"
117,forlorn,"pitifully sad and abandoned or lonely., (of an aim or endeavour) unlikely to succeed or be fulfilled.","forlorn figures at bus stops, a forlorn attempt to escape","morose, pitiful, heartbroken, with no chance of success, fed up, dejected, depressed, piteous, lachrymose, useless, bootless, despairing, forgotten, purposeless, hopeless, doleful, blue, downhearted, uncared-for, deserted, forsaken, despondent, crestfallen, beyond hope, unavailing, pathetic, woebegone, heart-rending, desolate, nugatory, down in the dumps, neglected, down in the mouth, out of sorts, failed, regretful, cheerless, sad, abandoned, vain, unsuccessful, unhappy, glum, disconsolate, futile, abject, pointless, heavy-hearted, broken-hearted, down, joyless, woeful, melancholy, miserable, dispirited, mournful, gloomy, wretched, long-faced, downcast, pitiable, sorrowful, tearful"
118,frivolity,lack of seriousness; light-heartedness.,a night of fun and frivolity,"shallowness, facetiousness, superficiality, frivolousness, giddiness, ditziness, levity, flightiness, inanity, empty-headedness, dippiness, daftness, light-heartedness, fun, foolishness, joking, flippancy, zaniness, skittishness, dizziness, jocularity, silliness, gaiety, vacuity"
119,frugality,the quality of being economical with money or food; thriftiness.,he scorned the finer things in life and valued frugality and simplicity,"good management, scrimping and saving, providence, conservation, meanness, monasticism, sparingness, thriftiness, parsimoniousness, stinginess, carefulness, monkishness, abstinence, canniness, moderation, caution, niggardliness, close-fistedness, miserliness, tight-fistedness, self-discipline, tightness, abstemiousness, restraint, asceticism, austerity, puritanism, prudence"
120,furtively,in a way that attempts to avoid notice or attention; secretively.,I furtively glanced over at my father to see his reaction,
121,gallantry,"courageous behaviour, especially in battle., polite attention or respect given by men to women.","a medal awarded for outstanding gallantry during the raid, no young man offers to carry this burden for her: such gallantry is out of fashion","fearlessness, respect, pluckiness, gameness, braveness, balls, bravery, gutsiness, bottle, consideration, spine, intrepidity, ballsiness, mettle, determination, spirit, stout-heartedness, courageousness, cojones, good manners, backbone, considerateness, chivalrousness, courage, moxie, mannerliness, spiritedness, sand, politeness, nerve, heroism, chivalry, doughtiness, intrepidness, dauntlessness, pluck, courtesy, guts, valour, boldness, daring, grit, spunk, courtliness, attentiveness, thoughtfulness, courteousness, graciousness, gentlemanliness, respectfulness, fortitude, manliness"
122,garrulous,"excessively talkative, especially on trivial matters.",a garrulous cab driver,"talkative, blathering, prattling, yacking, digressive, gobby, gabby, verbose, gushing, chattering, forthcoming, rambling, windy, prolonged, babbling, meandering, effusive, long-winded, wordy, chattery, lengthy, conversational, talky, wandering, prolix, multiloquous, gossipy, jabbering, mouthy, wittering, expansive, gassy, chatty, communicative, discursive, loquacious, multiloquent, voluble, with the gift of the gab, prating, periphrastic, big-mouthed, gossiping, diffuse, maundering"
123,geniality,the quality of having a friendly and cheerful manner.,he was endowed with geniality and good humour,"cordiality, neighbourliness, bluffness, cheeriness, conviviality, easy-going nature, palliness, approachability, good humour, congeniality, gregariousness, warmth, good nature, cheerfulness, mateyness, affability, sympathetic nature, friendliness, sociability, chumminess, companionableness, amiability, hospitality"
124,gentrification,"the process whereby the character of a poor urban area is changed by wealthier people moving in, improving housing, and attracting new businesses, often displacing current inhabitants in the process.",an area undergoing rapid gentrification,
125,geriatric,"relating to old people, especially with regard to their healthcare., an old person who is receiving special care.","a geriatric hospital, a rest home for geriatrics",
126,germane,relevant to a subject under consideration.,that is not germane to our theme,"appropriate, analogous, material, to the point, apropos, allied, suited, to the purpose, apposite, related, apt, admissible, ad rem, akin, fitting, relevant, suitable, felicitous, appurtenant, pertinent, applicable, linked, connected, proper"
127,glib,(of words or a speaker) fluent but insincere and shallow.,the glib phrases soon roll off the tongue,"sweet-talking, fluent, easy, smooth-tongued, smooth-spoken, superficial, flip, silver-tongued, insincere, oversimplified, with the gift of the gab, pat, simplistic, facile, urbane, plausible, flippant, voluble, smooth, fast-talking, silky, smooth-talking, neat, disingenuous, loquacious, slick, ready, shallow"
128,grandiose,"impressive and imposing in appearance or style, especially pretentiously so.",the court's grandiose facade,"stately, luxurious, awe-inspiring, flash, resplendent, impressive, imposing, elaborate, opulent, palatial, majestic, plush, grand, superb, magnificent, monumental, classy, flashy, large, glorious, swanky, lavish, striking, splendid"
129,gratified,give (someone) pleasure or satisfaction.,she was gratified to see the shock in Jim's eyes,"satisfy, tickle someone pink, make someone feel good, give someone a buzz/kick, make happy, please, warm the cockles of the heart, buck someone up, delight, gladden, thrill, make content, give pleasure to"
130,hackneyed,(of a phrase or idea) having been overused; unoriginal and trite.,hackneyed old sayings,"old hat, clichéd, corny, run-of-the-mill, vapid, pedestrian, platitudinous, stereotyped, time-worn, played out, overworked, worn out, boring, tired, uninspired, overdone, ordinary, unimaginative, unoriginal, derivative, bromidic, stale, dime-store, banal, hack, routine, hoary, conventional, common, prosaic, overused, cornball, truistic, humdrum, hacky, threadbare, dull, commonplace, predictable, trite, stock"
132,hedonistic,engaged in the pursuit of pleasure; sensually self-indulgent.,"a hedonistic existence of booze, drugs, and parties","unrestrained, lotus-eating, luxurious, excessive, sybaritic, immoderate, extravagant, voluptuous, overindulgent, fast-living, sensual, decadent, indulgent, intemperate, pleasure-seeking, epicurean, self-indulgent, pleasure-loving"
134,heretical,believing in or practising religious heresy.,heretical beliefs,"unbelieving, recreant, revisionist, heterodox, nonconformist, apostate, non-believing, dissenting, renegade, non-theistic, separatist, dissident, sceptical, freethinking, agnostic, idolatrous, nullifidian, sectarian, heathen, unorthodox, iconoclastic, impious, schismatic, atheistical, pagan, recusant, paynim"
135,hoi polloi,the masses; the common people.,avoid mixing with the hoi polloi,"the proletariat, the proles, the riff-raff, the ragtag (and bobtail), the commonality, the rabble, the herd, the lower orders, the rank and file, the mob, the commonalty, the common herd, the third estate, the masses, the crowd, the plebs, the common people, the peasants, the canaille, the multitude, the many, the populace, the people, the plebeians, the great unwashed, the commons, the public"
137,hubris,excessive pride or self-confidence.,the self-assured hubris among economists was shaken in the late 1980s,"conceitedness, arrogance, self-conceit, uppitiness, self-importance, conceit, superciliousness, vanity, feeling of superiority, pride, haughtiness, big-headedness, pomposity, hauteur"
138,iconoclastic,criticizing or attacking cherished beliefs or institutions.,an iconoclastic filmmaker who has pushed the boundaries with every film he's made,"questioning, malcontent, sceptical, dissenting, rebellious, mutinous, groundbreaking, maverick, nonconformist, dissentient, critical, dissident, subversive, innovative, irreverent, original, renegade, heretical"
139,imbroglio,"an extremely confused, complicated, or embarrassing situation.",the abdication imbroglio of 1936,"complexity, quandary, dilemma, trouble, tight corner, muddle, plight, deep water, difficulty, complication, corner, hole, mare's nest, predicament, entanglement, sticky situation, hot water, complicated situation, confusion, mess, bind, jam, pickle, scrape, problem, fix"
140,impassive,not feeling or showing emotion.,"his cold, impassive face","poker-faced, wooden, vacant, lifeless, dispassionate, inexpressive, unexpressive, inscrutable, expressionless, blank, stony, empty, glazed, fixed, straight-faced, unresponsive, deadpan"
141,impinge,"have an effect, especially a negative one.",several factors impinge on market efficiency,"influence, have a bearing on, leave a mark on, touch, make an impact on, exert influence on, affect, have an effect on, make an impression on"
