142,inadvertent,not resulting from or achieved through deliberate planning.,an inadvertent administrative error occurred that resulted in an overpayment,"unmeant, unintended, innocent, unconscious, unpremeditated, unplanned, unthinking, involuntary, unwitting, thoughtless, careless, accidental, unintentional, uncalculated, coincidental, chance"
143,indefatigable,(of a person or their efforts) persisting tirelessly.,an indefatigable defender of human rights,"unfaltering, indomitable, dogged, single-minded, dynamic, never-tiring, unflagging, assiduous, untiring, unswerving, persistent, tireless, industrious, unwearying, unwearied, unremitting, determined, tenacious, unshakeable, energetic, enthusiastic, relentless, unrelenting"
144,indelible,(of ink or a pen) making marks that cannot be removed.,an indelible marker pen,"unexpungeable, enduring, indestructible, unfading, unforgettable, ineradicable, permanent, lasting, inerasable, imperishable, haunting, memorable, ineffaceable, persisting, ingrained, not/never to be forgotten, stubborn"
145,indignant,feeling or showing anger or annoyance at what is perceived as unfair treatment.,he was indignant at being the object of suspicion,"browned off, discontented, resentful, disgruntled, in high dudgeon, irritated, miffed, pissed off, distressed, riled, hurt, peeved, annoyed, put out, in a huff, irked, chagrined, affronted, unhappy, piqued, upset, angry, not best pleased, steamed, offended, vexed, pissed, disturbed, pained, aggravated, cheesed off, sore, nettled, aggrieved, dissatisfied"
146,indolence,avoidance of activity or exertion; laziness.,my failure is probably due to my own indolence,"dormancy, lethargy, otiosity, slackness, negligence, lifelessness, remissness, inactivity, languidness, sloth, sluggishness, laxity, torpor, laziness, inaction, inertia, languor, shiftlessness, idleness, slowness, hebetude, dullness, slothfulness, torpidity"
147,inept,having or showing no skill; clumsy.,the referee's inept handling of the match,"unsuccessful, awkward, klutzy, amateurish, wanting, incompetent, inadequate, unskilful, all fingers and thumbs, lacking, bumbling, unhandy, inexpert, clumsy, ham-handed, all thumbs, blundering, inferior, not up to scratch, bungling, unskilled, substandard, botched, ham-fisted, ineffectual, cack-handed, heavy-handed, maladroit, rough, butterfingered, unproductive, crude"
148,ineptitude,lack of skill or ability.,the officials displayed remarkable ineptitude,
149,inequity,lack of fairness or justice.,policies aimed at redressing racial inequity,"unfairness, partiality, favouritism, one-sidedness, prejudice, discrimination, unjustness, bias, partisanship, injustice"
150,infringe,"actively break the terms of (a law, agreement, etc.)., act so as to limit or undermine (something); encroach on.","making an unauthorized copy would infringe copyright, such widespread surveillance could infringe personal liberties","kick against, exceed, intrude on, disturb, impinge on, entrench on, break, check, disobey, disrupt, barge in on, violate, disregard, fail to comply with, neglect, weaken, commit a breach of, impair, take no notice of, transgress, breach, fail to observe, go beyond, diminish, erode, compromise, interfere with, ignore, fly in the face of, trespass on, contravene, infract, ride roughshod over, limit, overstep, undermine, cock a snook at, invade, damage, flout, place a limit on, encroach on, enter, defy, burst in on, curb"
151,innocuous,not harmful or offensive.,it was an innocuous question,"tame, safe, edible, mild, insipid, commonplace, gentle, peaceful, non-toxic, non-injurious, innocent, unobjectionable, innoxious, anodyne, unoffending, non-irritant, inoffensive, bland, harmless, non-poisonous, unexceptionable, eatable, unremarkable, non-dangerous, run-of-the-mill, wholesome"
152,inscrutable,impossible to understand or interpret.,Guy looked blankly inscrutable,"inexpressive, impossible to interpret, sibylline, fathomless, beyond understanding, beyond comprehension, wildering, incomprehensible, puzzling, unfathomable, perplexing, cryptic, enigmatic, unintelligible, obscure, blank, emotionless, expressionless, unexplainable, vacant, impossible to understand, unemotional, bewildering, arcane, unexpressive, impenetrable, inexplicable, abstruse, confusing, mysterious, opaque, baffling, unreadable, dispassionate, impassive, poker-faced, deadpan"
153,insipid,lacking flavour; weak or tasteless.,mugs of insipid coffee,"watered-down, tasteless, weak, wishy-washy, bland, unflavoured, flavourless, thin, savourless, wersh, unpalatable, unappetizing, watery"
154,intemperance,lack of moderation or restraint.,his occasional intemperance of tone,"alcoholism, lavishness, tipsiness, drunkenness, lack of self-control, intemperateness, alcohol abuse, self-indulgence, hard/heavy drinking, overindulgence, decadence, profligacy, bibulousness, excessiveness, dissolution, dissoluteness, immoderation, intoxication, extravagance, abandon, insobriety, crapulence, dipsomania, lack of restraint, overconsumption, drinking, debauchery, self-gratification, excess, prodigality, dissipation, wantonness, sottishness, inebriation, inebriety"
155,inveighing,speak or write about (something) with great hostility.,he liked to inveigh against all forms of academic training,"complain vehemently about, declaim, decry, kick up a stink about, protest, beef about, censure, rail, rage, run down, revile, impugn, lash, bellyache about, remonstrate, condemn, vilify, kick up a fuss about, disparage, grouch about, sound off about, denounce, criticize, abuse, denigrate, storm, fulminate, tongue-lash"
156,inveterate,"having a particular habit, activity, or interest that is long-established and unlikely to change.",an inveterate gambler,"entrenched, deep-rooted, irredeemable, established, congenital, ineradicable, ingrained, incurable, long-established, deep-set, deep-seated"
157,irked,irritate; annoy.,it irks her to think of the runaround she received,"get on someone's wick, displease, rile, get up someone's nose, tee off, miff, ruffle, burn up, give someone the pip, rattle, exasperate, needle, make someone see red, get under someone's skin, rub up the wrong way, gall, hack off, try someone's patience, madden, peeve, incense, ride, get on someone's tits, drive round the twist, put out, nark, brown off, get on someone's nerves, tick off, make cross, vex, bug, get someone's dander up, infuriate, rankle, aggravate, bum out, make someone's blood boil, gravel, rattle someone's cage, wind up, ruffle someone's feathers, antagonize, cheese off, drive up the wall, make angry, annoy, nettle, anger, get to, piss off, make someone's hackles rise, give someone the hump, drive mad/crazy, pique, discountenance, get, get/put someone's back up, rark, get someone's goat, goad, irritate, provoke, get across, raise someone's hackles"
159,irresolute,showing or feeling hesitancy; uncertain.,she stood irresolute outside his door,"tentative, undecided, blowing hot and cold, divided, torn, in a quandary, fluctuating, unsure, faltering, sitting on the fence, equivocating, ambivalent, teetering, uncommitted, undetermined, weak, wavering, nervous, unresolved, vacillating, uncertain, in doubt, doubtful, in a dilemma, iffy, full of doubt, indecisive, in two minds, shilly-shallying, dithering, hesitant"
161,jettison,"throw or drop (something) from an aircraft or ship., the action of jettisoning something.","six aircraft jettisoned their loads in the sea, the jettison lever",
162,jockeying,struggle by every available means to gain or achieve something.,both men will be jockeying for the two top jobs,"contend, scramble, jostle, tussle, vie, compete, fight, push, struggle"
163,kismet,destiny; fate.,what chance did I stand against kismet?,"luck, predestiny, fortune, predetermination, providence, one's doom, one's portion, one's lot, preordination, the stars, what is written in the stars, one's lot in life, what is to come, karma, one's dole, the writing on the wall, predestination, fate, God's will, destiny, chance"
164,laconic,"(of a person, speech, or style of writing) using very few words.",his laconic reply suggested a lack of interest in the topic,"quiet, aphoristic, untalkative, elliptical, reticent, to the point, silent, short, sharp, of few words, crisp, monosyllabic, concise, economical, gruff, unforthcoming, clipped, curt, compendious, short and sweet, tight-lipped, tart, incisive, blunt, gnomic, taciturn, speechless, pithy, brief, abrupt, terse, uncommunicative, reserved, pointed, brusque, epigrammatic, succinct"
165,lambasted,criticize (someone or something) harshly.,they lambasted the report as a gross distortion of the truth,"revile, lay into, chide, castigate, tick off, rail at, condemn, tell off, objurgate, slag off, chew out, censure, scold, tear into, lace into, rant at, reprehend, carpet, rebuke, bawl out, haul/call over the coals, take to task, upbraid, rap someone's knuckles, harangue, chastise, reprove, criticize, attack, dress down, give someone a dressing-down, excoriate, berate, reprimand, have a go at, pitch into, fulminate against, admonish, slap someone's wrist"
166,lampooning,"publicly criticize (someone or something) by using ridicule, irony, or sarcasm.",the actor was lampooned by the press,"caricature, poke fun at, burlesque, send up, guy, pasquinade, parody, take off, satirize, make fun of, make a fool of, tease, ridicule, mock, rag"
167,languid,"(of a person, manner, or gesture) having or showing a disinclination for physical exertion or effort., weak or faint from illness or fatigue.","his languid demeanour irritated her, she was pale, languid, and weak, as if she had delivered a child","relaxed, languorous, weary, inactive, indolent, frail, lacking in energy, weak, sickly, delicate, lackadaisical, unhurried, otiose, drooping, slow, indifferent, fatigued, slow-moving, slothful, apathetic, unenergetic, lazy, idle, debilitated, sluggish, lethargic, impassive, flagging, listless, tired, uninterested, enervated, torpid, pococurante, laid back, Laodicean, faint, feeble, phlegmatic"
168,languor,"tiredness or inactivity, especially when pleasurable., an oppressive stillness of the air.","her whole being was pervaded by a dreamy languor, the afternoon was hot, quiet, and heavy with languor","listlessness, heaviness, indolence, lethargy, weariness, calmness, silence, sleepiness, lifelessness, fatigue, inactivity, lassitude, apathy, sluggishness, oppressiveness, torpor, windlessness, drowsiness, laziness, inertia, calm, stillness, lull, idleness, tranquillity, enervation, tiredness, somnolence"
169,levity,the treatment of a serious matter with humour or lack of due respect.,"as an attempt to introduce a note of levity, the words were a disastrous flop","carefreeness, facetiousness, light-mindedness, frivolousness, jollity, giddiness, cheeriness, wit, drollery, sportiveness, conviviality, triviality, amusement, vivacity, joviality, hilarity, laughter, funniness, liveliness, light-heartedness, irreverence, comedy, blitheness, wittiness, good cheer, high spirits, mirth, cheerfulness, fun, foolishness, joking, flippancy, skittishness, childishness, nonsense, jocularity, silliness, merriment, glee, gaiety, humour, frivolity"
170,malign,"evil in nature or effect., speak about (someone) in a spitefully critical manner.","she had a strong and malign influence, don't you dare malign her in my presence","do a hatchet job on, accuse falsely, bad-mouth, inimical, speak ill of, cast aspersions on, run a smear campaign against, denigrate, injurious, spiteful, libel, spread lies about, maleficent, knock, revile, vicious, misrepresent, vilify, throw/sling/fling mud at, abuse, traduce, baleful, calumniate, derogate, destructive, malefic, bad, malevolent, slander, malicious, run down, harmful, malignant, evil-intentioned, drag through the mud/mire, slur, slag off, vilipend, smear, evil, disparage, asperse, defame, hostile, rubbish"
171,maundering,talk in a rambling manner.,Dennis maundered on about the wine,"yabber, yackety-yak, babble, blather, waffle, rattle, yatter, yak, slabber, drivel, prattle, jabber, rabbit, twaddle, blether, clack, prate, natter, chatter, blither, ramble, chunter, gab, gabble, witter"
172,maxim,"a short, pithy statement expressing a general truth or rule of conduct.",the maxim that actions speak louder than words,"epigram, axiom, saw, catchphrase, truism, motto, saying, proverb, slogan, byword, apophthegm, dictum, cliché, watchword, adage, bon mot, platitude, aphorism, precept"
173,mendacious,not telling the truth; lying.,mendacious propaganda,"invented, perfidious, double-dealing, unveracious, made up, false, two-faced, perjured, duplicitous, fraudulent, dissembling, fabricated, insincere, hollow, economical with the truth, fictitious, untrue, disingenuous, terminologically inexact, deceitful, untruthful, hypocritical, Janus-faced, two-timing, fallacious, falsified, dishonest, lying"
174,mendacity,untruthfulness.,people publicly castigated for past mendacity,"fraudulence, fraud, duplicity, double-dealing, falsity, dishonesty, falseness, economy with the truth, deceitfulness, two-timing, hollowness, kidology, perfidy, untruthfulness, disingenuousness, dissembling, falsehood, deceit, untruth, terminological inexactitude, fallaciousness, deception, lying, insincerity, codology, hypocrisy, unveracity, perjury, fictitiousness"
175,misanthropic,having or showing a dislike of other people; unsociable.,a misanthropic drunken loner,"sceptical, reclusive, unfriendly, distrustful, unneighbourly, cynical, uncongenial, jaundiced, antisocial, unsociable, narrow-minded, suspicious, inhospitable"
176,miserliness,excessive desire to save money; extreme meanness.,the party earned a damaging reputation for miserliness by cutting pensions,"cheapness, penuriousness, thrift, meanness, closeness, penny-pinching, parsimoniousness, greed, stinginess, masochism, avarice, niggardliness, close-fistedness, nearness, illiberality, acquisitiveness, tight-fistedness, minginess, tightness, parsimony, asceticism, puritanism, cheese-paring"
177,mollify,appease the anger or anxiety of (someone).,nature reserves were set up around the power stations to mollify local conservationists,"calm down, propitiate, calm, conciliate, placate, appease, still, humour, square someone off, quiet, quieten, pacify, soothe"
179,moribund,(of a person) at the point of death.,on examination she was moribund and dehydrated,"breathing one's last, in extremis, on one's deathbed, expiring, near the end, near death, failing rapidly, not long for this world, on one's last legs, with one foot in the grave, fading/sinking fast, at death's door, dying"
180,munificent,characterized by or displaying great generosity.,a munificent bequest,"handsome, open-handed, beneficent, ungrudging, magnanimous, unstinting, unstinted, charitable, big-hearted, princely, generous, bounteous, lavish, free-handed, free, liberal, philanthropic, bountiful"
182,nebulous,"in the form of a cloud or haze; hazy., (of a concept) vague or ill-defined.","a giant nebulous glow, nebulous concepts like quality of life","hazy, blurred, shapeless, uncertain, faint, confused, indefinite, cloudy, lacking definition, indistinct, imprecise, out of focus, ill-defined, muddled, obscure, fuzzy, foggy, amorphous, muddy, shadowy, blurry, unformed, formless, vague, misty, indeterminate, ambiguous, dim, nebulose, opaque, unclear, inchoate"
183,nefarious,(typically of an action or activity) wicked or criminal.,the nefarious activities of the organized-crime syndicates,"flagitious, ungodly, evil, diabolical, disgraceful, wicked, criminal, outrageous, corrupt, depraved, infernal, devilish, unspeakable, dastardly, atrocious, appalling, unholy, shocking, base, abhorrent, egregious, shameful, knavish, abominable, odious, villainous, scandalous, vile, despicable, dark, fiendish, sinful, iniquitous, foul, heinous, satanic, monstrous"
184,nescient,lacking knowledge; ignorant.,I ventured into the new Korean restaurant with some equally nescient companions,
185,noxious,"harmful, poisonous, or very unpleasant.",they were overcome by the noxious fumes,"nauseous, unhealthy, pernicious, putrid, appalling, horrid, insalubrious, nasty, sickening, deadly, environmentally unfriendly, dreadful, noisome, miasmic, vile, foul-smelling, foul, evil-smelling, dangerous, mephitic, disgusting, horrible, rancid, bogging, virulent, destructive, damaging, very unpleasant, toxic, revolting, offensive, fetid, nocuous, harmful, ghastly, olid, awful, nauseating, malodorous, terrible, poisonous, disgustful, unwholesome, miasmal"
186,nuanced,characterized by subtle shades of meaning or expression.,Lowe's work has gradually grown more nuanced,
187,nugatory,of no value or importance.,a nugatory and pointless observation,"worthless, of no value, inconsequential, unimportant, meaningless, valueless, of no importance, trivial, of no consequence, trifling, insignificant"
189,obfuscate,"make obscure, unclear, or unintelligible.",the spelling changes will deform some familiar words and obfuscate their etymological origins,"blur, cloud, befog, complicate, jumble, confuse, muddy the waters, muddy, garble, obscure, make obscure/unclear, muddle"
191,obfuscation,"the action of making something obscure, unclear, or unintelligible.",when confronted with sharp questions they resort to obfuscation,
192,obscure,"not discovered or known about; uncertain., not clearly expressed or easily understood., keep from being seen; conceal.","his origins and parentage are obscure, obscure references to Proust, grey clouds obscure the sun","unintelligible, shroud, impenetrable, cover, recondite, elliptical, in doubt, opaque, block, as clear as mud, mask, conceal, obliterate, puzzling, uncertain, mystifying, occult, perplexing, uninterpretable, bedim, abstruse, unfathomable, hazy, oblique, riddling, esoteric, mysterious, cloak, block out, benight, obnubilate, hidden, enshroud, shadow, dubious, hide, inexplicable, Delphic, cryptic, incomprehensible, envelop, recherché, unclear, mantle, unexplained, veil, overshadow, arcane, screen, concealed, ambiguous, adumbrate, equivocal, doubtful, unknown, blank out, eclipse, cast a shadow over, enigmatic, baffling, oracular, indeterminate, vague"
193,obsequious,obedient or attentive to an excessive or servile degree.,they were served by obsequious waiters,"toadyish, soapy, ingratiating, slimy, subservient, servile, sycophantic, smarmy, oily, sucky, cringing, bum-sucking, oleaginous, submissive, bootlicking, sycophantish, ass-kissing, brown-nosing, greasy, abject, fawning, grovelling, toadying, unctuous, Uriah Heepish, kiss-ass, arse-licking, slavish"
195,obstinate,"stubbornly refusing to change one's opinion or chosen course of action, despite attempts to persuade one to do so.",her obstinate determination to pursue a career in radio,"indurate, perverse, with one's toes/feet dug in, iron-willed, relentless, dogged, steadfast, unbending, unpersuadable, adamant, stubborn as a mule, firm, stroppy, uncompromising, unmalleable, mulish, froward, persistent, single-minded, headstrong, uncooperative, unyielding, wilful, self-willed, determined, obdurate, contrarious, persevering, bloody-minded, steely, stiff-necked, intractable, unrelenting, unshakeable, tenacious, pig-headed, stiff, immovable, intransigent, refractory, balky, recalcitrant, inflexible, bull-headed, pertinacious, strong-minded, unmanageable, stubborn, contrary, cross-grained, rigid, contumacious, implacable, inexorable, strong-willed, bolshie"
196,officious,"assertive of authority in a domineering way, especially with regard to trivial matters.",the security people were very officious,
197,operatic,relating to or characteristic of opera.,operatic arias,
198,ossified,"having turned into bone or bony tissue., having become rigid or fixed in attitude or position.","ossified cartilage, an ossified institution",
199,ostensibly,"as appears or is stated to be true, though not necessarily so; apparently.","the party secretary resigned, ostensibly from ill health","ostensively, on the surface, seemingly, to all intents and purposes, purportedly, pretendedly, professedly, superficially, allegedly, outwardly, to all appearances, supposedly, apparently, on the face of it"
200,outstrip,move faster than and overtake (someone else).,"during the morning warm-up, he once again outstripped the field","gain on, draw away from, walk away from, go faster than, outpace, shake off, outdistance, overtake, get (further) ahead of, lose, pass, leave standing, throw off, leave behind, outrun"
201,overarching,comprehensive or all-embracing.,a single overarching principle,
202,paean,a song of praise or triumph.,a paean of praise for the great poets,
203,palatable,(of food or drink) pleasant to taste.,a very palatable local red wine,"ambrosial, tasty, dainty, drinkable, scrummy, delish, sapid, yummy, nectareous, pleasant-tasting, finger-licking, flavorous, peng, scrumptious, appetizing, delectable, nectarean, ambrosian, luscious, yum-yum, delicious, comestible, eatable, enjoyable, nummy, edible, flavoursome, succulent, toothsome, mouth-watering, moreish, flavourful, savoury"
204,panacea,a solution or remedy for all difficulties or diseases.,the panacea for all corporate ills,"nostrum, wonder drug, elixir, sovereign remedy, perfect solution, magic bullet, cure for all ills, universal cure, cure-all, magic formula, universal remedy, diacatholicon, catholicon, heal-all, panpharmacon"
205,parochial,"relating to a Church parish., having a limited or narrow outlook or scope.","the parochial church council, parochial attitudes","petty, inward-looking, restricted, jerkwater, conservative, small-minded, blinkered, hidebound, illiberal, insular, conventional, intolerant, introverted, provincial, limited, narrow, short-sighted, hick, close-minded, narrow-minded, localist, small-town, myopic, parish-pump"
206,patronize,"treat in a way that is apparently kind or helpful but that betrays a feeling of superiority., frequent (a shop, restaurant, or other establishment) as a customer.","she was determined not to be put down or patronized, restaurants and bars regularly patronized by the stars were often crowded with paparazzi","look down on, support, frequent, subscribe to, magisterial, join, become a member of, look down one's nose at, condescending, trade with, treat with condescension, lofty, put down, uppity, shop at, stuck-up, attend, cavalier, toffee-nosed, fancy-pants, scornful, snooty, deal with, haughty, be a client of, superior, high and mighty, disdainful, talk down to, condescend to, be a customer of, hang out at, treat like a child, snobbish, do business with, haunt, humiliate, visit, lordly, supercilious, pompous, treat with disdain, bring trade/custom to, treat condescendingly, treat as inferior, be snobbish to, buy from, contemptuous, imperious"
207,paucity,the presence of something in only small or insufficient quantities or amounts.,a paucity of information,"scantiness, scarcity, dearth, paltriness, lack, insufficiency, deficiency, famine, rarity, rareness, exiguity, want, shortfall, sparsity, sparseness, inadequacy, shortage, meagreness, deficit, poverty, restrictedness, limitedness, skimpiness"
208,peeve,"annoy or irritate., a cause of annoyance.","that was the one thing that peeved him, another peeve of mine is these so called reality shows","piss off, irritate, hack off, aggrieved, nettle, browned off, agitate, in high dudgeon, riled, upset, rankle, gall, raise someone's hackles, bait, narked, cheesed off, aggravated, tick off, rark, galled, pissed off, enraged, not best pleased, pique, brassed off, get/put someone's back up, offended, rankle with, gravel, exasperate, exasperated, provoke, piqued, sore, bother, miff, annoyed, furious, rub up the wrong way, indignant, get across, bothered, disgruntle, vexed, miffed, steamed, displeased, peed off, irk, disgruntled, get to, hump, ticked off, displease, give someone the hump, get under someone's skin, hacked off, eggy, irritated, irked, dissatisfied, ruffle, vex, ruffled, anger, rasp, nettled, drive to distraction, goad, put out, in a temper, make someone's hackles rise, cross, get in someone's hair, ride, get on someone's nerves, exacerbate, get someone's goat, needle, resentful, nark, affronted, angered, aggravate, get up someone's nose, angry, annoy, teed off, get, get on someone's wick, ruffle someone's feathers, bug, rile, wind up"
209,penury,the state of being very poor; extreme poverty.,he couldn't face another year of penury,"pauperism, impoverishment, reduced circumstances, ruin, impecuniousness, straitened circumstances, deprivation, mendicity, need, hardship, pennilessness, indigence, beggary, extreme/dire poverty, want, pauperdom, destitution, bankruptcy, privation, insolvency, neediness"
210,perfunctory,"(of an action) carried out without real interest, feeling, or effort.",he gave a perfunctory nod,"rapid, casual, uninterested, automatic, routine, cursory, careless, desultory, dismissive, sketchy, passing, indifferent, summary, superficial, unthinking, mechanical, hurried, half-hearted, token, hasty, fleeting, brief, quick, offhand, inattentive"
211,perplexing,completely baffling; very puzzling.,a perplexing problem,
212,personable,(of a person) having a pleasant appearance and manner.,he was so personable and well-spoken,"appealing, good-natured, attractive, comely, presentable, couthy, nice, good-looking, likeable, engaging, congenial, genial, pleasing, affable, amiable, agreeable, nice-looking, pretty, pleasant, canny, bonny, charming, taking"
213,perturbed,feeling anxiety or concern; unsettled.,she didn't seem perturbed about the noises around her,
214,perusal,the action of reading or examining something.,I continued my perusal of the instructions,"study, browse, glance, review, scanning, skim, scrutiny, look, reading, examination, inspection, read, scan"
